mysql> select ename,concat(upper(left(ename,1)),lower(substr(ename,2))) from emp;
+----------+-----------------------------------------------------+
| ename    | concat(upper(left(ename,1)),lower(substr(ename,2))) |
+----------+-----------------------------------------------------+
| GITA     | Gita                                                |
| VRUSHALI | Vrushali                                            |
| SHARMIN  | Sharmin                                             |
| BANDISH  | Bandish                                             |
| SMITH    | Smith                                               |
| AARAV    | Aarav                                               |
| THOMAS   | Thomas                                              |
| ALLEN    | Allen                                               |
| WARD     | Ward                                                |
| JONES    | Jones                                               |
| MARTIN   | Martin                                              |
| BLAKE    | Blake                                               |
| CLARK    | Clark                                               |
| SCOTT    | Scott                                               |
| KING     | King                                                |
| FRED     | Fred                                                |
| TURNER   | Turner                                              |
| ADAMS    | Adams                                               |
| JAMES    | James                                               |
| FORD     | Ford                                                |
| HOFFMAN  | Hoffman                                             |
| GRASS    | Grass                                               |
| MILLER   | Miller                                              |
| AARUSH   | Aarush                                              |
| ALEX     | Alex                                                |
| NATASHA  | Natasha                                             |
| SANGITA  | Sangita                                             |
| SUPRIYA  | Supriya                                             |
+----------+-----------------------------------------------------+
28 rows in set (0.00 sec)

mysql> table emp;
+-------+----------+--------+---------------------+------+------------+------+------+--------+---------+--------------+------------+------------+----------+
| EMPNO | ENAME    | GENDER | JOB                 | MGR  | HIREDATE   | SAL  | COMM | DEPTNO | BONUSID | USER NAME    | PWD        | PHONE      | isActive |
+-------+----------+--------+---------------------+------+------------+------+------+--------+---------+--------------+------------+------------+----------+
|  6001 | GITA     | F      | Compliance officers | 7920 | 1981-07-19 | 1750 | NULL |     30 |       1 | GITA         | sales@2017 | NULL       |        1 |
|  6129 | VRUSHALI | F      | Compliance officers | 7920 | 1981-07-19 | 1750 | NULL |     50 |       1 | VRUSHALI     | PUN@8877   | NULL       |        1 |
|  6473 | SHARMIN  | F      | Public Relation     | 7920 | 1981-07-19 | 1750 | NULL |     20 |       1 | SHARMIN      | a12recmpm  | NULL       |        1 |
|  6781 | BANDISH  | F      | Public Relation     | 7920 | 1981-07-19 | 1750 | NULL |     20 |       1 | BANDISH      | a12recmpm  | NULL       |        1 |
|  7369 | SMITH    | M      | CLERK               | 7902 | 1980-12-17 |  800 | NULL |     20 |       2 | TRITONE      | a12recmpm  | 7032300023 |        0 |
|  7415 | AARAV    | M      | CLERK               | 7902 | 1981-12-31 | 3350 | NULL |     10 |    NULL | AARAV        | NULL       | 7032300084 |        0 |
|  7421 | THOMAS   | M      | CLERK               | 7920 | 1981-07-19 | 1750 | NULL |     10 |       1 | THOMAS       | r50mpm     | 7032300011 |        0 |
|  7499 | ALLEN    | M      | SALESMAN            | 7698 | 1981-02-20 | 1600 |  300 |     30 |       4 | ALWAYS TESTE | sales@2017 | 7032300096 |        1 |
|  7521 | WARD     | M      | SALESMAN            | 7698 | 1981-02-22 | 1250 |  500 |     30 |       1 | WARD         | sales@2017 | 7132300034 |        1 |
|  7566 | JONES    | M      | MANAGER             | 7839 | 1981-04-02 | 2975 | NULL |     20 |       4 | HONEYCOMB    | a12recmpm  | 7132300039 |        1 |
|  7654 | MARTIN   | M      | SALESMAN            | 7698 | 1981-09-28 | 1250 | 1400 |     30 |       6 | LIFE RACER   | sales@2017 | 7132300050 |        1 |
|  7698 | BLAKE    | M      | MANAGER             | 7839 | 1981-05-01 | 2850 | NULL |     30 |       1 | BIG BEN      | sales@2017 | 7132300027 |        1 |
|  7782 | CLARK    | M      | MANAGER             | 7839 | 1981-06-09 | 2450 | NULL |     10 |       3 | CLARK        | r50mpm     | 7032300001 |        1 |
|  7788 | SCOTT    | M      | ANALYST             | 7566 | 1982-12-09 | 3000 | NULL |     20 |       3 | WHITE SAND   | a12recmpm  | NULL       |        1 |
|  7839 | KING     | M      | PRESIDENT           | NULL | 1981-11-17 | 5000 | NULL |     10 |       1 | KING         | r50mpm     | 7132300081 |        1 |
|  7840 | FRED     | M      | vice PRESIDENT      | 7839 | 1983-08-09 | 5000 | NULL |     20 |       1 | SAND STONE   | a12recmpm  | NULL       |        1 |
|  7844 | TURNER   | M      | SALESMAN            | 7698 | 1981-09-08 | 1500 |    0 |     30 |       5 | SAND DUST    | sales@2017 | NULL       |        1 |
|  7876 | ADAMS    | M      | CLERK               | 7788 | 1983-01-12 | 1100 | NULL |     20 |       1 | CRAZY ANYONE | a12recmpm  | 7132300086 |        1 |
|  7900 | JAMES    | M      | CLERK               | 7698 | 1981-12-03 |  950 | NULL |     30 |       2 | CRAZY LEADER | sales@2017 | 7132300042 |        1 |
|  7902 | FORD     | M      | ANALYST             | 7566 | 1981-12-03 | 3000 | NULL |     20 |       4 | CONBRIO      | a12recmpm  | NULL       |        0 |
|  7919 | HOFFMAN  | M      | MANAGER             | 7566 | 1982-03-24 | 4150 | NULL |     30 |       3 | INTERVAL     | sales@2017 | NULL       |        1 |
|  7920 | GRASS    | M      | SALESMAN            | 7919 | 1980-02-14 | 2575 | 2700 |     30 |       5 | GRASS        | sales@2017 | NULL       |        1 |
|  7934 | MILLER   | M      | CLERK               | 7782 | 1982-01-23 | 1300 | NULL |     10 |       2 | QUARTERNOTE  | r50mpm     | 7132300055 |        0 |
|  7945 | AARUSH   | M      | SALESMAN            | 7902 | 1980-02-14 | 1350 | 2700 |     30 |    NULL | AARUSH       | ABCDEF     | NULL       |        0 |
|  7949 | ALEX     | M      | MANAGER             | 7698 | 1982-01-24 | 1250 |  500 |     30 |       5 | QUARTERREST  | sales@2017 | 7156567183 |        1 |
|  8433 | NATASHA  | F      | CLERK               | 7920 | 1981-07-19 | 1750 | NULL |     30 |       1 | NATASHA      | sales@2017 | NULL       |        1 |
|  9400 | SANGITA  | F      | Compliance officers | 7920 | 1981-07-19 | 1750 | NULL |     50 |       1 | SANGITA      | NULL       | NULL       |        1 |
|  9473 | SUPRIYA  | F      | ANALYST             | 7920 | 1981-07-19 | 1750 | NULL |     50 |       1 | SUPRIYA      | XYZ@1234   | NULL       |        1 |
+-------+----------+--------+---------------------+------+------------+------+------+--------+---------+--------------+------------+------------+----------+
28 rows in set (0.00 sec)

mysql> update emp set job=replace(job,'officer','Officer');
Query OK, 3 rows affected (0.00 sec)
Rows matched: 28  Changed: 3  Warnings: 0

mysql> table emp;
+-------+----------+--------+---------------------+------+------------+------+------+--------+---------+--------------+------------+------------+----------+
| EMPNO | ENAME    | GENDER | JOB                 | MGR  | HIREDATE   | SAL  | COMM | DEPTNO | BONUSID | USER NAME    | PWD        | PHONE      | isActive |
+-------+----------+--------+---------------------+------+------------+------+------+--------+---------+--------------+------------+------------+----------+
|  6001 | GITA     | F      | Compliance Officers | 7920 | 1981-07-19 | 1750 | NULL |     30 |       1 | GITA         | sales@2017 | NULL       |        1 |
|  6129 | VRUSHALI | F      | Compliance Officers | 7920 | 1981-07-19 | 1750 | NULL |     50 |       1 | VRUSHALI     | PUN@8877   | NULL       |        1 |
|  6473 | SHARMIN  | F      | Public Relation     | 7920 | 1981-07-19 | 1750 | NULL |     20 |       1 | SHARMIN      | a12recmpm  | NULL       |        1 |
|  6781 | BANDISH  | F      | Public Relation     | 7920 | 1981-07-19 | 1750 | NULL |     20 |       1 | BANDISH      | a12recmpm  | NULL       |        1 |
|  7369 | SMITH    | M      | CLERK               | 7902 | 1980-12-17 |  800 | NULL |     20 |       2 | TRITONE      | a12recmpm  | 7032300023 |        0 |
|  7415 | AARAV    | M      | CLERK               | 7902 | 1981-12-31 | 3350 | NULL |     10 |    NULL | AARAV        | NULL       | 7032300084 |        0 |
|  7421 | THOMAS   | M      | CLERK               | 7920 | 1981-07-19 | 1750 | NULL |     10 |       1 | THOMAS       | r50mpm     | 7032300011 |        0 |
|  7499 | ALLEN    | M      | SALESMAN            | 7698 | 1981-02-20 | 1600 |  300 |     30 |       4 | ALWAYS TESTE | sales@2017 | 7032300096 |        1 |
|  7521 | WARD     | M      | SALESMAN            | 7698 | 1981-02-22 | 1250 |  500 |     30 |       1 | WARD         | sales@2017 | 7132300034 |        1 |
|  7566 | JONES    | M      | MANAGER             | 7839 | 1981-04-02 | 2975 | NULL |     20 |       4 | HONEYCOMB    | a12recmpm  | 7132300039 |        1 |
|  7654 | MARTIN   | M      | SALESMAN            | 7698 | 1981-09-28 | 1250 | 1400 |     30 |       6 | LIFE RACER   | sales@2017 | 7132300050 |        1 |
|  7698 | BLAKE    | M      | MANAGER             | 7839 | 1981-05-01 | 2850 | NULL |     30 |       1 | BIG BEN      | sales@2017 | 7132300027 |        1 |
|  7782 | CLARK    | M      | MANAGER             | 7839 | 1981-06-09 | 2450 | NULL |     10 |       3 | CLARK        | r50mpm     | 7032300001 |        1 |
|  7788 | SCOTT    | M      | ANALYST             | 7566 | 1982-12-09 | 3000 | NULL |     20 |       3 | WHITE SAND   | a12recmpm  | NULL       |        1 |
|  7839 | KING     | M      | PRESIDENT           | NULL | 1981-11-17 | 5000 | NULL |     10 |       1 | KING         | r50mpm     | 7132300081 |        1 |
|  7840 | FRED     | M      | vice PRESIDENT      | 7839 | 1983-08-09 | 5000 | NULL |     20 |       1 | SAND STONE   | a12recmpm  | NULL       |        1 |
|  7844 | TURNER   | M      | SALESMAN            | 7698 | 1981-09-08 | 1500 |    0 |     30 |       5 | SAND DUST    | sales@2017 | NULL       |        1 |
|  7876 | ADAMS    | M      | CLERK               | 7788 | 1983-01-12 | 1100 | NULL |     20 |       1 | CRAZY ANYONE | a12recmpm  | 7132300086 |        1 |
|  7900 | JAMES    | M      | CLERK               | 7698 | 1981-12-03 |  950 | NULL |     30 |       2 | CRAZY LEADER | sales@2017 | 7132300042 |        1 |
|  7902 | FORD     | M      | ANALYST             | 7566 | 1981-12-03 | 3000 | NULL |     20 |       4 | CONBRIO      | a12recmpm  | NULL       |        0 |
|  7919 | HOFFMAN  | M      | MANAGER             | 7566 | 1982-03-24 | 4150 | NULL |     30 |       3 | INTERVAL     | sales@2017 | NULL       |        1 |
|  7920 | GRASS    | M      | SALESMAN            | 7919 | 1980-02-14 | 2575 | 2700 |     30 |       5 | GRASS        | sales@2017 | NULL       |        1 |
|  7934 | MILLER   | M      | CLERK               | 7782 | 1982-01-23 | 1300 | NULL |     10 |       2 | QUARTERNOTE  | r50mpm     | 7132300055 |        0 |
|  7945 | AARUSH   | M      | SALESMAN            | 7902 | 1980-02-14 | 1350 | 2700 |     30 |    NULL | AARUSH       | ABCDEF     | NULL       |        0 |
|  7949 | ALEX     | M      | MANAGER             | 7698 | 1982-01-24 | 1250 |  500 |     30 |       5 | QUARTERREST  | sales@2017 | 7156567183 |        1 |
|  8433 | NATASHA  | F      | CLERK               | 7920 | 1981-07-19 | 1750 | NULL |     30 |       1 | NATASHA      | sales@2017 | NULL       |        1 |
|  9400 | SANGITA  | F      | Compliance Officers | 7920 | 1981-07-19 | 1750 | NULL |     50 |       1 | SANGITA      | NULL       | NULL       |        1 |
|  9473 | SUPRIYA  | F      | ANALYST             | 7920 | 1981-07-19 | 1750 | NULL |     50 |       1 | SUPRIYA      | XYZ@1234   | NULL       |        1 |
+-------+----------+--------+---------------------+------+------------+------+------+--------+---------+--------------+------------+------------+----------+
28 rows in set (0.00 sec)

mysql> rollback;
Query OK, 0 rows affected (0.09 sec)

mysql> table emp;
+-------+----------+--------+---------------------+------+------------+------+------+--------+---------+--------------+------------+------------+----------+
| EMPNO | ENAME    | GENDER | JOB                 | MGR  | HIREDATE   | SAL  | COMM | DEPTNO | BONUSID | USER NAME    | PWD        | PHONE      | isActive |
+-------+----------+--------+---------------------+------+------------+------+------+--------+---------+--------------+------------+------------+----------+
|  6001 | GITA     | F      | Compliance officers | 7920 | 1981-07-19 | 1750 | NULL |     30 |       1 | GITA         | sales@2017 | NULL       |        1 |
|  6129 | VRUSHALI | F      | Compliance officers | 7920 | 1981-07-19 | 1750 | NULL |     50 |       1 | VRUSHALI     | PUN@8877   | NULL       |        1 |
|  6473 | SHARMIN  | F      | Public Relation     | 7920 | 1981-07-19 | 1750 | NULL |     20 |       1 | SHARMIN      | a12recmpm  | NULL       |        1 |
|  6781 | BANDISH  | F      | Public Relation     | 7920 | 1981-07-19 | 1750 | NULL |     20 |       1 | BANDISH      | a12recmpm  | NULL       |        1 |
|  7369 | SMITH    | M      | CLERK               | 7902 | 1980-12-17 |  800 | NULL |     20 |       2 | TRITONE      | a12recmpm  | 7032300023 |        0 |
|  7415 | AARAV    | M      | CLERK               | 7902 | 1981-12-31 | 3350 | NULL |     10 |    NULL | AARAV        | NULL       | 7032300084 |        0 |
|  7421 | THOMAS   | M      | CLERK               | 7920 | 1981-07-19 | 1750 | NULL |     10 |       1 | THOMAS       | r50mpm     | 7032300011 |        0 |
|  7499 | ALLEN    | M      | SALESMAN            | 7698 | 1981-02-20 | 1600 |  300 |     30 |       4 | ALWAYS TESTE | sales@2017 | 7032300096 |        1 |
|  7521 | WARD     | M      | SALESMAN            | 7698 | 1981-02-22 | 1250 |  500 |     30 |       1 | WARD         | sales@2017 | 7132300034 |        1 |
|  7566 | JONES    | M      | MANAGER             | 7839 | 1981-04-02 | 2975 | NULL |     20 |       4 | HONEYCOMB    | a12recmpm  | 7132300039 |        1 |
|  7654 | MARTIN   | M      | SALESMAN            | 7698 | 1981-09-28 | 1250 | 1400 |     30 |       6 | LIFE RACER   | sales@2017 | 7132300050 |        1 |
|  7698 | BLAKE    | M      | MANAGER             | 7839 | 1981-05-01 | 2850 | NULL |     30 |       1 | BIG BEN      | sales@2017 | 7132300027 |        1 |
|  7782 | CLARK    | M      | MANAGER             | 7839 | 1981-06-09 | 2450 | NULL |     10 |       3 | CLARK        | r50mpm     | 7032300001 |        1 |
|  7788 | SCOTT    | M      | ANALYST             | 7566 | 1982-12-09 | 3000 | NULL |     20 |       3 | WHITE SAND   | a12recmpm  | NULL       |        1 |
|  7839 | KING     | M      | PRESIDENT           | NULL | 1981-11-17 | 5000 | NULL |     10 |       1 | KING         | r50mpm     | 7132300081 |        1 |
|  7840 | FRED     | M      | vice PRESIDENT      | 7839 | 1983-08-09 | 5000 | NULL |     20 |       1 | SAND STONE   | a12recmpm  | NULL       |        1 |
|  7844 | TURNER   | M      | SALESMAN            | 7698 | 1981-09-08 | 1500 |    0 |     30 |       5 | SAND DUST    | sales@2017 | NULL       |        1 |
|  7876 | ADAMS    | M      | CLERK               | 7788 | 1983-01-12 | 1100 | NULL |     20 |       1 | CRAZY ANYONE | a12recmpm  | 7132300086 |        1 |
|  7900 | JAMES    | M      | CLERK               | 7698 | 1981-12-03 |  950 | NULL |     30 |       2 | CRAZY LEADER | sales@2017 | 7132300042 |        1 |
|  7902 | FORD     | M      | ANALYST             | 7566 | 1981-12-03 | 3000 | NULL |     20 |       4 | CONBRIO      | a12recmpm  | NULL       |        0 |
|  7919 | HOFFMAN  | M      | MANAGER             | 7566 | 1982-03-24 | 4150 | NULL |     30 |       3 | INTERVAL     | sales@2017 | NULL       |        1 |
|  7920 | GRASS    | M      | SALESMAN            | 7919 | 1980-02-14 | 2575 | 2700 |     30 |       5 | GRASS        | sales@2017 | NULL       |        1 |
|  7934 | MILLER   | M      | CLERK               | 7782 | 1982-01-23 | 1300 | NULL |     10 |       2 | QUARTERNOTE  | r50mpm     | 7132300055 |        0 |
|  7945 | AARUSH   | M      | SALESMAN            | 7902 | 1980-02-14 | 1350 | 2700 |     30 |    NULL | AARUSH       | ABCDEF     | NULL       |        0 |
|  7949 | ALEX     | M      | MANAGER             | 7698 | 1982-01-24 | 1250 |  500 |     30 |       5 | QUARTERREST  | sales@2017 | 7156567183 |        1 |
|  8433 | NATASHA  | F      | CLERK               | 7920 | 1981-07-19 | 1750 | NULL |     30 |       1 | NATASHA      | sales@2017 | NULL       |        1 |
|  9400 | SANGITA  | F      | Compliance officers | 7920 | 1981-07-19 | 1750 | NULL |     50 |       1 | SANGITA      | NULL       | NULL       |        1 |
|  9473 | SUPRIYA  | F      | ANALYST             | 7920 | 1981-07-19 | 1750 | NULL |     50 |       1 | SUPRIYA      | XYZ@1234   | NULL       |        1 |
+-------+----------+--------+---------------------+------+------------+------+------+--------+---------+--------------+------------+------------+----------+
28 rows in set (0.00 sec)

mysql> update emp set job=replace(job,'officers','Officers');
Query OK, 3 rows affected (0.00 sec)
Rows matched: 28  Changed: 3  Warnings: 0

mysql> table emp;
+-------+----------+--------+---------------------+------+------------+------+------+--------+---------+--------------+------------+------------+----------+
| EMPNO | ENAME    | GENDER | JOB                 | MGR  | HIREDATE   | SAL  | COMM | DEPTNO | BONUSID | USER NAME    | PWD        | PHONE      | isActive |
+-------+----------+--------+---------------------+------+------------+------+------+--------+---------+--------------+------------+------------+----------+
|  6001 | GITA     | F      | Compliance Officers | 7920 | 1981-07-19 | 1750 | NULL |     30 |       1 | GITA         | sales@2017 | NULL       |        1 |
|  6129 | VRUSHALI | F      | Compliance Officers | 7920 | 1981-07-19 | 1750 | NULL |     50 |       1 | VRUSHALI     | PUN@8877   | NULL       |        1 |
|  6473 | SHARMIN  | F      | Public Relation     | 7920 | 1981-07-19 | 1750 | NULL |     20 |       1 | SHARMIN      | a12recmpm  | NULL       |        1 |
|  6781 | BANDISH  | F      | Public Relation     | 7920 | 1981-07-19 | 1750 | NULL |     20 |       1 | BANDISH      | a12recmpm  | NULL       |        1 |
|  7369 | SMITH    | M      | CLERK               | 7902 | 1980-12-17 |  800 | NULL |     20 |       2 | TRITONE      | a12recmpm  | 7032300023 |        0 |
|  7415 | AARAV    | M      | CLERK               | 7902 | 1981-12-31 | 3350 | NULL |     10 |    NULL | AARAV        | NULL       | 7032300084 |        0 |
|  7421 | THOMAS   | M      | CLERK               | 7920 | 1981-07-19 | 1750 | NULL |     10 |       1 | THOMAS       | r50mpm     | 7032300011 |        0 |
|  7499 | ALLEN    | M      | SALESMAN            | 7698 | 1981-02-20 | 1600 |  300 |     30 |       4 | ALWAYS TESTE | sales@2017 | 7032300096 |        1 |
|  7521 | WARD     | M      | SALESMAN            | 7698 | 1981-02-22 | 1250 |  500 |     30 |       1 | WARD         | sales@2017 | 7132300034 |        1 |
|  7566 | JONES    | M      | MANAGER             | 7839 | 1981-04-02 | 2975 | NULL |     20 |       4 | HONEYCOMB    | a12recmpm  | 7132300039 |        1 |
|  7654 | MARTIN   | M      | SALESMAN            | 7698 | 1981-09-28 | 1250 | 1400 |     30 |       6 | LIFE RACER   | sales@2017 | 7132300050 |        1 |
|  7698 | BLAKE    | M      | MANAGER             | 7839 | 1981-05-01 | 2850 | NULL |     30 |       1 | BIG BEN      | sales@2017 | 7132300027 |        1 |
|  7782 | CLARK    | M      | MANAGER             | 7839 | 1981-06-09 | 2450 | NULL |     10 |       3 | CLARK        | r50mpm     | 7032300001 |        1 |
|  7788 | SCOTT    | M      | ANALYST             | 7566 | 1982-12-09 | 3000 | NULL |     20 |       3 | WHITE SAND   | a12recmpm  | NULL       |        1 |
|  7839 | KING     | M      | PRESIDENT           | NULL | 1981-11-17 | 5000 | NULL |     10 |       1 | KING         | r50mpm     | 7132300081 |        1 |
|  7840 | FRED     | M      | vice PRESIDENT      | 7839 | 1983-08-09 | 5000 | NULL |     20 |       1 | SAND STONE   | a12recmpm  | NULL       |        1 |
|  7844 | TURNER   | M      | SALESMAN            | 7698 | 1981-09-08 | 1500 |    0 |     30 |       5 | SAND DUST    | sales@2017 | NULL       |        1 |
|  7876 | ADAMS    | M      | CLERK               | 7788 | 1983-01-12 | 1100 | NULL |     20 |       1 | CRAZY ANYONE | a12recmpm  | 7132300086 |        1 |
|  7900 | JAMES    | M      | CLERK               | 7698 | 1981-12-03 |  950 | NULL |     30 |       2 | CRAZY LEADER | sales@2017 | 7132300042 |        1 |
|  7902 | FORD     | M      | ANALYST             | 7566 | 1981-12-03 | 3000 | NULL |     20 |       4 | CONBRIO      | a12recmpm  | NULL       |        0 |
|  7919 | HOFFMAN  | M      | MANAGER             | 7566 | 1982-03-24 | 4150 | NULL |     30 |       3 | INTERVAL     | sales@2017 | NULL       |        1 |
|  7920 | GRASS    | M      | SALESMAN            | 7919 | 1980-02-14 | 2575 | 2700 |     30 |       5 | GRASS        | sales@2017 | NULL       |        1 |
|  7934 | MILLER   | M      | CLERK               | 7782 | 1982-01-23 | 1300 | NULL |     10 |       2 | QUARTERNOTE  | r50mpm     | 7132300055 |        0 |
|  7945 | AARUSH   | M      | SALESMAN            | 7902 | 1980-02-14 | 1350 | 2700 |     30 |    NULL | AARUSH       | ABCDEF     | NULL       |        0 |
|  7949 | ALEX     | M      | MANAGER             | 7698 | 1982-01-24 | 1250 |  500 |     30 |       5 | QUARTERREST  | sales@2017 | 7156567183 |        1 |
|  8433 | NATASHA  | F      | CLERK               | 7920 | 1981-07-19 | 1750 | NULL |     30 |       1 | NATASHA      | sales@2017 | NULL       |        1 |
|  9400 | SANGITA  | F      | Compliance Officers | 7920 | 1981-07-19 | 1750 | NULL |     50 |       1 | SANGITA      | NULL       | NULL       |        1 |
|  9473 | SUPRIYA  | F      | ANALYST             | 7920 | 1981-07-19 | 1750 | NULL |     50 |       1 | SUPRIYA      | XYZ@1234   | NULL       |        1 |
+-------+----------+--------+---------------------+------+------------+------+------+--------+---------+--------------+------------+------------+----------+
28 rows in set (0.00 sec)

mysql> rollback;
Query OK, 0 rows affected (0.07 sec)

mysql> update emp set job=replace(job,'off','Off');
Query OK, 3 rows affected (0.00 sec)
Rows matched: 28  Changed: 3  Warnings: 0

mysql> table emp;
+-------+----------+--------+---------------------+------+------------+------+------+--------+---------+--------------+------------+------------+----------+
| EMPNO | ENAME    | GENDER | JOB                 | MGR  | HIREDATE   | SAL  | COMM | DEPTNO | BONUSID | USER NAME    | PWD        | PHONE      | isActive |
+-------+----------+--------+---------------------+------+------------+------+------+--------+---------+--------------+------------+------------+----------+
|  6001 | GITA     | F      | Compliance Officers | 7920 | 1981-07-19 | 1750 | NULL |     30 |       1 | GITA         | sales@2017 | NULL       |        1 |
|  6129 | VRUSHALI | F      | Compliance Officers | 7920 | 1981-07-19 | 1750 | NULL |     50 |       1 | VRUSHALI     | PUN@8877   | NULL       |        1 |
|  6473 | SHARMIN  | F      | Public Relation     | 7920 | 1981-07-19 | 1750 | NULL |     20 |       1 | SHARMIN      | a12recmpm  | NULL       |        1 |
|  6781 | BANDISH  | F      | Public Relation     | 7920 | 1981-07-19 | 1750 | NULL |     20 |       1 | BANDISH      | a12recmpm  | NULL       |        1 |
|  7369 | SMITH    | M      | CLERK               | 7902 | 1980-12-17 |  800 | NULL |     20 |       2 | TRITONE      | a12recmpm  | 7032300023 |        0 |
|  7415 | AARAV    | M      | CLERK               | 7902 | 1981-12-31 | 3350 | NULL |     10 |    NULL | AARAV        | NULL       | 7032300084 |        0 |
|  7421 | THOMAS   | M      | CLERK               | 7920 | 1981-07-19 | 1750 | NULL |     10 |       1 | THOMAS       | r50mpm     | 7032300011 |        0 |
|  7499 | ALLEN    | M      | SALESMAN            | 7698 | 1981-02-20 | 1600 |  300 |     30 |       4 | ALWAYS TESTE | sales@2017 | 7032300096 |        1 |
|  7521 | WARD     | M      | SALESMAN            | 7698 | 1981-02-22 | 1250 |  500 |     30 |       1 | WARD         | sales@2017 | 7132300034 |        1 |
|  7566 | JONES    | M      | MANAGER             | 7839 | 1981-04-02 | 2975 | NULL |     20 |       4 | HONEYCOMB    | a12recmpm  | 7132300039 |        1 |
|  7654 | MARTIN   | M      | SALESMAN            | 7698 | 1981-09-28 | 1250 | 1400 |     30 |       6 | LIFE RACER   | sales@2017 | 7132300050 |        1 |
|  7698 | BLAKE    | M      | MANAGER             | 7839 | 1981-05-01 | 2850 | NULL |     30 |       1 | BIG BEN      | sales@2017 | 7132300027 |        1 |
|  7782 | CLARK    | M      | MANAGER             | 7839 | 1981-06-09 | 2450 | NULL |     10 |       3 | CLARK        | r50mpm     | 7032300001 |        1 |
|  7788 | SCOTT    | M      | ANALYST             | 7566 | 1982-12-09 | 3000 | NULL |     20 |       3 | WHITE SAND   | a12recmpm  | NULL       |        1 |
|  7839 | KING     | M      | PRESIDENT           | NULL | 1981-11-17 | 5000 | NULL |     10 |       1 | KING         | r50mpm     | 7132300081 |        1 |
|  7840 | FRED     | M      | vice PRESIDENT      | 7839 | 1983-08-09 | 5000 | NULL |     20 |       1 | SAND STONE   | a12recmpm  | NULL       |        1 |
|  7844 | TURNER   | M      | SALESMAN            | 7698 | 1981-09-08 | 1500 |    0 |     30 |       5 | SAND DUST    | sales@2017 | NULL       |        1 |
|  7876 | ADAMS    | M      | CLERK               | 7788 | 1983-01-12 | 1100 | NULL |     20 |       1 | CRAZY ANYONE | a12recmpm  | 7132300086 |        1 |
|  7900 | JAMES    | M      | CLERK               | 7698 | 1981-12-03 |  950 | NULL |     30 |       2 | CRAZY LEADER | sales@2017 | 7132300042 |        1 |
|  7902 | FORD     | M      | ANALYST             | 7566 | 1981-12-03 | 3000 | NULL |     20 |       4 | CONBRIO      | a12recmpm  | NULL       |        0 |
|  7919 | HOFFMAN  | M      | MANAGER             | 7566 | 1982-03-24 | 4150 | NULL |     30 |       3 | INTERVAL     | sales@2017 | NULL       |        1 |
|  7920 | GRASS    | M      | SALESMAN            | 7919 | 1980-02-14 | 2575 | 2700 |     30 |       5 | GRASS        | sales@2017 | NULL       |        1 |
|  7934 | MILLER   | M      | CLERK               | 7782 | 1982-01-23 | 1300 | NULL |     10 |       2 | QUARTERNOTE  | r50mpm     | 7132300055 |        0 |
|  7945 | AARUSH   | M      | SALESMAN            | 7902 | 1980-02-14 | 1350 | 2700 |     30 |    NULL | AARUSH       | ABCDEF     | NULL       |        0 |
|  7949 | ALEX     | M      | MANAGER             | 7698 | 1982-01-24 | 1250 |  500 |     30 |       5 | QUARTERREST  | sales@2017 | 7156567183 |        1 |
|  8433 | NATASHA  | F      | CLERK               | 7920 | 1981-07-19 | 1750 | NULL |     30 |       1 | NATASHA      | sales@2017 | NULL       |        1 |
|  9400 | SANGITA  | F      | Compliance Officers | 7920 | 1981-07-19 | 1750 | NULL |     50 |       1 | SANGITA      | NULL       | NULL       |        1 |
|  9473 | SUPRIYA  | F      | ANALYST             | 7920 | 1981-07-19 | 1750 | NULL |     50 |       1 | SUPRIYA      | XYZ@1234   | NULL       |        1 |
+-------+----------+--------+---------------------+------+------------+------+------+--------+---------+--------------+------------+------------+----------+
28 rows in set (0.00 sec)

mysql> update emp set job=replace(*,0,2);
ERROR 1064 (42000): You have an error in your SQL syntax; check the manual that corresponds to your MySQL server version for the right syntax to use near '*,0,2)' at line 1
mysql> update emp set empno=replace(*,0,2);
ERROR 1064 (42000): You have an error in your SQL syntax; check the manual that corresponds to your MySQL server version for the right syntax to use near '*,0,2)' at line 1
mysql> update emp set empno=replace(empno,0,2);
ERROR 1451 (23000): Cannot delete or update a parent row: a foreign key constraint fails (`db1`.`emp`, CONSTRAINT `EMP_FOREIGN_KEY_mgr` FOREIGN KEY (`MGR`) REFERENCES `emp` (`EMPNO`))
mysql> update emp set sal=replace(sal,0,2);
Query OK, 26 rows affected (0.00 sec)
Rows matched: 28  Changed: 26  Warnings: 0

mysql> table emp;
+-------+----------+--------+---------------------+------+------------+------+------+--------+---------+--------------+------------+------------+----------+
| EMPNO | ENAME    | GENDER | JOB                 | MGR  | HIREDATE   | SAL  | COMM | DEPTNO | BONUSID | USER NAME    | PWD        | PHONE      | isActive |
+-------+----------+--------+---------------------+------+------------+------+------+--------+---------+--------------+------------+------------+----------+
|  6001 | GITA     | F      | Compliance Officers | 7920 | 1981-07-19 | 1752 | NULL |     30 |       1 | GITA         | sales@2017 | NULL       |        1 |
|  6129 | VRUSHALI | F      | Compliance Officers | 7920 | 1981-07-19 | 1752 | NULL |     50 |       1 | VRUSHALI     | PUN@8877   | NULL       |        1 |
|  6473 | SHARMIN  | F      | Public Relation     | 7920 | 1981-07-19 | 1752 | NULL |     20 |       1 | SHARMIN      | a12recmpm  | NULL       |        1 |
|  6781 | BANDISH  | F      | Public Relation     | 7920 | 1981-07-19 | 1752 | NULL |     20 |       1 | BANDISH      | a12recmpm  | NULL       |        1 |
|  7369 | SMITH    | M      | CLERK               | 7902 | 1980-12-17 |  822 | NULL |     20 |       2 | TRITONE      | a12recmpm  | 7032300023 |        0 |
|  7415 | AARAV    | M      | CLERK               | 7902 | 1981-12-31 | 3352 | NULL |     10 |    NULL | AARAV        | NULL       | 7032300084 |        0 |
|  7421 | THOMAS   | M      | CLERK               | 7920 | 1981-07-19 | 1752 | NULL |     10 |       1 | THOMAS       | r50mpm     | 7032300011 |        0 |
|  7499 | ALLEN    | M      | SALESMAN            | 7698 | 1981-02-20 | 1622 |  300 |     30 |       4 | ALWAYS TESTE | sales@2017 | 7032300096 |        1 |
|  7521 | WARD     | M      | SALESMAN            | 7698 | 1981-02-22 | 1252 |  500 |     30 |       1 | WARD         | sales@2017 | 7132300034 |        1 |
|  7566 | JONES    | M      | MANAGER             | 7839 | 1981-04-02 | 2975 | NULL |     20 |       4 | HONEYCOMB    | a12recmpm  | 7132300039 |        1 |
|  7654 | MARTIN   | M      | SALESMAN            | 7698 | 1981-09-28 | 1252 | 1400 |     30 |       6 | LIFE RACER   | sales@2017 | 7132300050 |        1 |
|  7698 | BLAKE    | M      | MANAGER             | 7839 | 1981-05-01 | 2852 | NULL |     30 |       1 | BIG BEN      | sales@2017 | 7132300027 |        1 |
|  7782 | CLARK    | M      | MANAGER             | 7839 | 1981-06-09 | 2452 | NULL |     10 |       3 | CLARK        | r50mpm     | 7032300001 |        1 |
|  7788 | SCOTT    | M      | ANALYST             | 7566 | 1982-12-09 | 3222 | NULL |     20 |       3 | WHITE SAND   | a12recmpm  | NULL       |        1 |
|  7839 | KING     | M      | PRESIDENT           | NULL | 1981-11-17 | 5222 | NULL |     10 |       1 | KING         | r50mpm     | 7132300081 |        1 |
|  7840 | FRED     | M      | vice PRESIDENT      | 7839 | 1983-08-09 | 5222 | NULL |     20 |       1 | SAND STONE   | a12recmpm  | NULL       |        1 |
|  7844 | TURNER   | M      | SALESMAN            | 7698 | 1981-09-08 | 1522 |    0 |     30 |       5 | SAND DUST    | sales@2017 | NULL       |        1 |
|  7876 | ADAMS    | M      | CLERK               | 7788 | 1983-01-12 | 1122 | NULL |     20 |       1 | CRAZY ANYONE | a12recmpm  | 7132300086 |        1 |
|  7900 | JAMES    | M      | CLERK               | 7698 | 1981-12-03 |  952 | NULL |     30 |       2 | CRAZY LEADER | sales@2017 | 7132300042 |        1 |
|  7902 | FORD     | M      | ANALYST             | 7566 | 1981-12-03 | 3222 | NULL |     20 |       4 | CONBRIO      | a12recmpm  | NULL       |        0 |
|  7919 | HOFFMAN  | M      | MANAGER             | 7566 | 1982-03-24 | 4152 | NULL |     30 |       3 | INTERVAL     | sales@2017 | NULL       |        1 |
|  7920 | GRASS    | M      | SALESMAN            | 7919 | 1980-02-14 | 2575 | 2700 |     30 |       5 | GRASS        | sales@2017 | NULL       |        1 |
|  7934 | MILLER   | M      | CLERK               | 7782 | 1982-01-23 | 1322 | NULL |     10 |       2 | QUARTERNOTE  | r50mpm     | 7132300055 |        0 |
|  7945 | AARUSH   | M      | SALESMAN            | 7902 | 1980-02-14 | 1352 | 2700 |     30 |    NULL | AARUSH       | ABCDEF     | NULL       |        0 |
|  7949 | ALEX     | M      | MANAGER             | 7698 | 1982-01-24 | 1252 |  500 |     30 |       5 | QUARTERREST  | sales@2017 | 7156567183 |        1 |
|  8433 | NATASHA  | F      | CLERK               | 7920 | 1981-07-19 | 1752 | NULL |     30 |       1 | NATASHA      | sales@2017 | NULL       |        1 |
|  9400 | SANGITA  | F      | Compliance Officers | 7920 | 1981-07-19 | 1752 | NULL |     50 |       1 | SANGITA      | NULL       | NULL       |        1 |
|  9473 | SUPRIYA  | F      | ANALYST             | 7920 | 1981-07-19 | 1752 | NULL |     50 |       1 | SUPRIYA      | XYZ@1234   | NULL       |        1 |
+-------+----------+--------+---------------------+------+------------+------+------+--------+---------+--------------+------------+------------+----------+
28 rows in set (0.00 sec)

mysql> rollback;
Query OK, 0 rows affected (0.06 sec)

mysql> table emp;
+-------+----------+--------+---------------------+------+------------+------+------+--------+---------+--------------+------------+------------+----------+
| EMPNO | ENAME    | GENDER | JOB                 | MGR  | HIREDATE   | SAL  | COMM | DEPTNO | BONUSID | USER NAME    | PWD        | PHONE      | isActive |
+-------+----------+--------+---------------------+------+------------+------+------+--------+---------+--------------+------------+------------+----------+
|  6001 | GITA     | F      | Compliance officers | 7920 | 1981-07-19 | 1750 | NULL |     30 |       1 | GITA         | sales@2017 | NULL       |        1 |
|  6129 | VRUSHALI | F      | Compliance officers | 7920 | 1981-07-19 | 1750 | NULL |     50 |       1 | VRUSHALI     | PUN@8877   | NULL       |        1 |
|  6473 | SHARMIN  | F      | Public Relation     | 7920 | 1981-07-19 | 1750 | NULL |     20 |       1 | SHARMIN      | a12recmpm  | NULL       |        1 |
|  6781 | BANDISH  | F      | Public Relation     | 7920 | 1981-07-19 | 1750 | NULL |     20 |       1 | BANDISH      | a12recmpm  | NULL       |        1 |
|  7369 | SMITH    | M      | CLERK               | 7902 | 1980-12-17 |  800 | NULL |     20 |       2 | TRITONE      | a12recmpm  | 7032300023 |        0 |
|  7415 | AARAV    | M      | CLERK               | 7902 | 1981-12-31 | 3350 | NULL |     10 |    NULL | AARAV        | NULL       | 7032300084 |        0 |
|  7421 | THOMAS   | M      | CLERK               | 7920 | 1981-07-19 | 1750 | NULL |     10 |       1 | THOMAS       | r50mpm     | 7032300011 |        0 |
|  7499 | ALLEN    | M      | SALESMAN            | 7698 | 1981-02-20 | 1600 |  300 |     30 |       4 | ALWAYS TESTE | sales@2017 | 7032300096 |        1 |
|  7521 | WARD     | M      | SALESMAN            | 7698 | 1981-02-22 | 1250 |  500 |     30 |       1 | WARD         | sales@2017 | 7132300034 |        1 |
|  7566 | JONES    | M      | MANAGER             | 7839 | 1981-04-02 | 2975 | NULL |     20 |       4 | HONEYCOMB    | a12recmpm  | 7132300039 |        1 |
|  7654 | MARTIN   | M      | SALESMAN            | 7698 | 1981-09-28 | 1250 | 1400 |     30 |       6 | LIFE RACER   | sales@2017 | 7132300050 |        1 |
|  7698 | BLAKE    | M      | MANAGER             | 7839 | 1981-05-01 | 2850 | NULL |     30 |       1 | BIG BEN      | sales@2017 | 7132300027 |        1 |
|  7782 | CLARK    | M      | MANAGER             | 7839 | 1981-06-09 | 2450 | NULL |     10 |       3 | CLARK        | r50mpm     | 7032300001 |        1 |
|  7788 | SCOTT    | M      | ANALYST             | 7566 | 1982-12-09 | 3000 | NULL |     20 |       3 | WHITE SAND   | a12recmpm  | NULL       |        1 |
|  7839 | KING     | M      | PRESIDENT           | NULL | 1981-11-17 | 5000 | NULL |     10 |       1 | KING         | r50mpm     | 7132300081 |        1 |
|  7840 | FRED     | M      | vice PRESIDENT      | 7839 | 1983-08-09 | 5000 | NULL |     20 |       1 | SAND STONE   | a12recmpm  | NULL       |        1 |
|  7844 | TURNER   | M      | SALESMAN            | 7698 | 1981-09-08 | 1500 |    0 |     30 |       5 | SAND DUST    | sales@2017 | NULL       |        1 |
|  7876 | ADAMS    | M      | CLERK               | 7788 | 1983-01-12 | 1100 | NULL |     20 |       1 | CRAZY ANYONE | a12recmpm  | 7132300086 |        1 |
|  7900 | JAMES    | M      | CLERK               | 7698 | 1981-12-03 |  950 | NULL |     30 |       2 | CRAZY LEADER | sales@2017 | 7132300042 |        1 |
|  7902 | FORD     | M      | ANALYST             | 7566 | 1981-12-03 | 3000 | NULL |     20 |       4 | CONBRIO      | a12recmpm  | NULL       |        0 |
|  7919 | HOFFMAN  | M      | MANAGER             | 7566 | 1982-03-24 | 4150 | NULL |     30 |       3 | INTERVAL     | sales@2017 | NULL       |        1 |
|  7920 | GRASS    | M      | SALESMAN            | 7919 | 1980-02-14 | 2575 | 2700 |     30 |       5 | GRASS        | sales@2017 | NULL       |        1 |
|  7934 | MILLER   | M      | CLERK               | 7782 | 1982-01-23 | 1300 | NULL |     10 |       2 | QUARTERNOTE  | r50mpm     | 7132300055 |        0 |
|  7945 | AARUSH   | M      | SALESMAN            | 7902 | 1980-02-14 | 1350 | 2700 |     30 |    NULL | AARUSH       | ABCDEF     | NULL       |        0 |
|  7949 | ALEX     | M      | MANAGER             | 7698 | 1982-01-24 | 1250 |  500 |     30 |       5 | QUARTERREST  | sales@2017 | 7156567183 |        1 |
|  8433 | NATASHA  | F      | CLERK               | 7920 | 1981-07-19 | 1750 | NULL |     30 |       1 | NATASHA      | sales@2017 | NULL       |        1 |
|  9400 | SANGITA  | F      | Compliance officers | 7920 | 1981-07-19 | 1750 | NULL |     50 |       1 | SANGITA      | NULL       | NULL       |        1 |
|  9473 | SUPRIYA  | F      | ANALYST             | 7920 | 1981-07-19 | 1750 | NULL |     50 |       1 | SUPRIYA      | XYZ@1234   | NULL       |        1 |
+-------+----------+--------+---------------------+------+------------+------+------+--------+---------+--------------+------------+------------+----------+
28 rows in set (0.00 sec)

mysql> select * from transactions;
+-----+--------+---------------------+------+--------+
| _id | custId | transactionDate     | type | amount |
+-----+--------+---------------------+------+--------+
|   1 |   1002 | 2021-01-01 10:24:34 | c    |  30000 |
|   2 |   1001 | 2021-01-01 12:45:13 | c    |  30000 |
|   3 |   1003 | 2021-01-01 14:00:04 | c    |  30000 |
|   4 |   1002 | 2021-01-01 12:24:34 | c    | 370000 |
|   5 |   1001 | 2021-01-01 14:45:13 | c    | 370000 |
|   6 |   1003 | 2021-01-01 15:00:04 | c    | 370000 |
|   7 |   1002 | 2021-01-01 10:24:34 | d    |   7000 |
|   8 |   1001 | 2021-01-01 12:45:13 | d    |   7500 |
|   9 |   1003 | 2021-01-01 14:00:04 | d    |   7000 |
|  10 |   1001 | 2021-01-01 11:20:10 | d    |   2000 |
|  11 |   1002 | 2021-02-12 12:00:42 | d    |   4000 |
|  12 |   1001 | 2021-02-23 10:24:34 | d    |   1500 |
|  13 |   1003 | 2021-01-12 09:23:09 | d    |   1000 |
|  14 |   1001 | 2021-02-28 11:43:13 | c    |    500 |
|  15 |   1002 | 2021-03-13 12:23:31 | d    |    500 |
|  16 |   1002 | 2021-03-01 11:20:43 | c    |   1500 |
|  17 |   1003 | 2021-02-24 11:34:32 | c    |    200 |
|  18 |   1002 | 2021-04-30 14:20:32 | d    |   6000 |
|  19 |   1001 | 2021-02-27 11:43:10 | d    |   2000 |
|  20 |   1001 | 2021-03-17 09:15:23 | c    |   1200 |
|  21 |   1003 | 2021-04-06 09:13:22 | d    |   4500 |
|  22 |   1003 | 2021-02-04 11:32:43 | d    |   4200 |
|  23 |   1001 | 2021-05-14 10:17:10 | c    |    600 |
|  24 |   1003 | 2021-02-07 14:45:33 | c    |    400 |
|  25 |   1002 | 2021-04-29 15:53:23 | c    |   1200 |
|  26 |   1002 | 2021-06-23 09:53:54 | c    |   1600 |
|  27 |   1003 | 2021-03-06 11:50:34 | d    |   3000 |
|  28 |   1002 | 2021-04-30 14:20:33 | d    |   3000 |
|  29 |   1001 | 2021-05-14 10:17:13 | c    |    600 |
|  30 |   1003 | 2021-01-01 14:00:05 | d    |   7000 |
|  31 |   1002 | 2021-06-23 09:53:57 | c    |    250 |
|  32 |   1001 | 2021-05-14 10:17:18 | d    |   5600 |
|  33 |   1003 | 2021-03-06 11:50:37 | c    |    200 |
+-----+--------+---------------------+------+--------+
33 rows in set (0.06 sec)

mysql> select custId,transactionDate,type,amount,if(type='c',amount*-1,amount) r1 from transactions;
+--------+---------------------+------+--------+---------+
| custId | transactionDate     | type | amount | r1      |
+--------+---------------------+------+--------+---------+
|   1002 | 2021-01-01 10:24:34 | c    |  30000 |  -30000 |
|   1001 | 2021-01-01 12:45:13 | c    |  30000 |  -30000 |
|   1003 | 2021-01-01 14:00:04 | c    |  30000 |  -30000 |
|   1002 | 2021-01-01 12:24:34 | c    | 370000 | -370000 |
|   1001 | 2021-01-01 14:45:13 | c    | 370000 | -370000 |
|   1003 | 2021-01-01 15:00:04 | c    | 370000 | -370000 |
|   1002 | 2021-01-01 10:24:34 | d    |   7000 |    7000 |
|   1001 | 2021-01-01 12:45:13 | d    |   7500 |    7500 |
|   1003 | 2021-01-01 14:00:04 | d    |   7000 |    7000 |
|   1001 | 2021-01-01 11:20:10 | d    |   2000 |    2000 |
|   1002 | 2021-02-12 12:00:42 | d    |   4000 |    4000 |
|   1001 | 2021-02-23 10:24:34 | d    |   1500 |    1500 |
|   1003 | 2021-01-12 09:23:09 | d    |   1000 |    1000 |
|   1001 | 2021-02-28 11:43:13 | c    |    500 |    -500 |
|   1002 | 2021-03-13 12:23:31 | d    |    500 |     500 |
|   1002 | 2021-03-01 11:20:43 | c    |   1500 |   -1500 |
|   1003 | 2021-02-24 11:34:32 | c    |    200 |    -200 |
|   1002 | 2021-04-30 14:20:32 | d    |   6000 |    6000 |
|   1001 | 2021-02-27 11:43:10 | d    |   2000 |    2000 |
|   1001 | 2021-03-17 09:15:23 | c    |   1200 |   -1200 |
|   1003 | 2021-04-06 09:13:22 | d    |   4500 |    4500 |
|   1003 | 2021-02-04 11:32:43 | d    |   4200 |    4200 |
|   1001 | 2021-05-14 10:17:10 | c    |    600 |    -600 |
|   1003 | 2021-02-07 14:45:33 | c    |    400 |    -400 |
|   1002 | 2021-04-29 15:53:23 | c    |   1200 |   -1200 |
|   1002 | 2021-06-23 09:53:54 | c    |   1600 |   -1600 |
|   1003 | 2021-03-06 11:50:34 | d    |   3000 |    3000 |
|   1002 | 2021-04-30 14:20:33 | d    |   3000 |    3000 |
|   1001 | 2021-05-14 10:17:13 | c    |    600 |    -600 |
|   1003 | 2021-01-01 14:00:05 | d    |   7000 |    7000 |
|   1002 | 2021-06-23 09:53:57 | c    |    250 |    -250 |
|   1001 | 2021-05-14 10:17:18 | d    |   5600 |    5600 |
|   1003 | 2021-03-06 11:50:37 | c    |    200 |    -200 |
+--------+---------------------+------+--------+---------+
33 rows in set (0.00 sec)

mysql> select custId,transactionDate,type,amount,if(type='d',amount*-1,amount) r1 from transactions;
+--------+---------------------+------+--------+--------+
| custId | transactionDate     | type | amount | r1     |
+--------+---------------------+------+--------+--------+
|   1002 | 2021-01-01 10:24:34 | c    |  30000 |  30000 |
|   1001 | 2021-01-01 12:45:13 | c    |  30000 |  30000 |
|   1003 | 2021-01-01 14:00:04 | c    |  30000 |  30000 |
|   1002 | 2021-01-01 12:24:34 | c    | 370000 | 370000 |
|   1001 | 2021-01-01 14:45:13 | c    | 370000 | 370000 |
|   1003 | 2021-01-01 15:00:04 | c    | 370000 | 370000 |
|   1002 | 2021-01-01 10:24:34 | d    |   7000 |  -7000 |
|   1001 | 2021-01-01 12:45:13 | d    |   7500 |  -7500 |
|   1003 | 2021-01-01 14:00:04 | d    |   7000 |  -7000 |
|   1001 | 2021-01-01 11:20:10 | d    |   2000 |  -2000 |
|   1002 | 2021-02-12 12:00:42 | d    |   4000 |  -4000 |
|   1001 | 2021-02-23 10:24:34 | d    |   1500 |  -1500 |
|   1003 | 2021-01-12 09:23:09 | d    |   1000 |  -1000 |
|   1001 | 2021-02-28 11:43:13 | c    |    500 |    500 |
|   1002 | 2021-03-13 12:23:31 | d    |    500 |   -500 |
|   1002 | 2021-03-01 11:20:43 | c    |   1500 |   1500 |
|   1003 | 2021-02-24 11:34:32 | c    |    200 |    200 |
|   1002 | 2021-04-30 14:20:32 | d    |   6000 |  -6000 |
|   1001 | 2021-02-27 11:43:10 | d    |   2000 |  -2000 |
|   1001 | 2021-03-17 09:15:23 | c    |   1200 |   1200 |
|   1003 | 2021-04-06 09:13:22 | d    |   4500 |  -4500 |
|   1003 | 2021-02-04 11:32:43 | d    |   4200 |  -4200 |
|   1001 | 2021-05-14 10:17:10 | c    |    600 |    600 |
|   1003 | 2021-02-07 14:45:33 | c    |    400 |    400 |
|   1002 | 2021-04-29 15:53:23 | c    |   1200 |   1200 |
|   1002 | 2021-06-23 09:53:54 | c    |   1600 |   1600 |
|   1003 | 2021-03-06 11:50:34 | d    |   3000 |  -3000 |
|   1002 | 2021-04-30 14:20:33 | d    |   3000 |  -3000 |
|   1001 | 2021-05-14 10:17:13 | c    |    600 |    600 |
|   1003 | 2021-01-01 14:00:05 | d    |   7000 |  -7000 |
|   1002 | 2021-06-23 09:53:57 | c    |    250 |    250 |
|   1001 | 2021-05-14 10:17:18 | d    |   5600 |  -5600 |
|   1003 | 2021-03-06 11:50:37 | c    |    200 |    200 |
+--------+---------------------+------+--------+--------+
33 rows in set (0.00 sec)

mysql> select custId,transactionDate,type,amount,if(type='d',-amount,+amount) r1 from transactions;
+--------+---------------------+------+--------+--------+
| custId | transactionDate     | type | amount | r1     |
+--------+---------------------+------+--------+--------+
|   1002 | 2021-01-01 10:24:34 | c    |  30000 |  30000 |
|   1001 | 2021-01-01 12:45:13 | c    |  30000 |  30000 |
|   1003 | 2021-01-01 14:00:04 | c    |  30000 |  30000 |
|   1002 | 2021-01-01 12:24:34 | c    | 370000 | 370000 |
|   1001 | 2021-01-01 14:45:13 | c    | 370000 | 370000 |
|   1003 | 2021-01-01 15:00:04 | c    | 370000 | 370000 |
|   1002 | 2021-01-01 10:24:34 | d    |   7000 |  -7000 |
|   1001 | 2021-01-01 12:45:13 | d    |   7500 |  -7500 |
|   1003 | 2021-01-01 14:00:04 | d    |   7000 |  -7000 |
|   1001 | 2021-01-01 11:20:10 | d    |   2000 |  -2000 |
|   1002 | 2021-02-12 12:00:42 | d    |   4000 |  -4000 |
|   1001 | 2021-02-23 10:24:34 | d    |   1500 |  -1500 |
|   1003 | 2021-01-12 09:23:09 | d    |   1000 |  -1000 |
|   1001 | 2021-02-28 11:43:13 | c    |    500 |    500 |
|   1002 | 2021-03-13 12:23:31 | d    |    500 |   -500 |
|   1002 | 2021-03-01 11:20:43 | c    |   1500 |   1500 |
|   1003 | 2021-02-24 11:34:32 | c    |    200 |    200 |
|   1002 | 2021-04-30 14:20:32 | d    |   6000 |  -6000 |
|   1001 | 2021-02-27 11:43:10 | d    |   2000 |  -2000 |
|   1001 | 2021-03-17 09:15:23 | c    |   1200 |   1200 |
|   1003 | 2021-04-06 09:13:22 | d    |   4500 |  -4500 |
|   1003 | 2021-02-04 11:32:43 | d    |   4200 |  -4200 |
|   1001 | 2021-05-14 10:17:10 | c    |    600 |    600 |
|   1003 | 2021-02-07 14:45:33 | c    |    400 |    400 |
|   1002 | 2021-04-29 15:53:23 | c    |   1200 |   1200 |
|   1002 | 2021-06-23 09:53:54 | c    |   1600 |   1600 |
|   1003 | 2021-03-06 11:50:34 | d    |   3000 |  -3000 |
|   1002 | 2021-04-30 14:20:33 | d    |   3000 |  -3000 |
|   1001 | 2021-05-14 10:17:13 | c    |    600 |    600 |
|   1003 | 2021-01-01 14:00:05 | d    |   7000 |  -7000 |
|   1002 | 2021-06-23 09:53:57 | c    |    250 |    250 |
|   1001 | 2021-05-14 10:17:18 | d    |   5600 |  -5600 |
|   1003 | 2021-03-06 11:50:37 | c    |    200 |    200 |
+--------+---------------------+------+--------+--------+
33 rows in set (0.00 sec)

mysql> select -1+-1;
+-------+
| -1+-1 |
+-------+
|    -2 |
+-------+
1 row in set (0.03 sec)

mysql> select -1--1;
+-------+
| -1--1 |
+-------+
|     0 |
+-------+
1 row in set (0.00 sec)

mysql> select-1,1;
+----+---+
| -1 | 1 |
+----+---+
| -1 | 1 |
+----+---+
1 row in set (0.00 sec)

mysql> select custId,transactionDate,type,amount,if(type='d',-amount,amount) r1 from transactions;
+--------+---------------------+------+--------+--------+
| custId | transactionDate     | type | amount | r1     |
+--------+---------------------+------+--------+--------+
|   1002 | 2021-01-01 10:24:34 | c    |  30000 |  30000 |
|   1001 | 2021-01-01 12:45:13 | c    |  30000 |  30000 |
|   1003 | 2021-01-01 14:00:04 | c    |  30000 |  30000 |
|   1002 | 2021-01-01 12:24:34 | c    | 370000 | 370000 |
|   1001 | 2021-01-01 14:45:13 | c    | 370000 | 370000 |
|   1003 | 2021-01-01 15:00:04 | c    | 370000 | 370000 |
|   1002 | 2021-01-01 10:24:34 | d    |   7000 |  -7000 |
|   1001 | 2021-01-01 12:45:13 | d    |   7500 |  -7500 |
|   1003 | 2021-01-01 14:00:04 | d    |   7000 |  -7000 |
|   1001 | 2021-01-01 11:20:10 | d    |   2000 |  -2000 |
|   1002 | 2021-02-12 12:00:42 | d    |   4000 |  -4000 |
|   1001 | 2021-02-23 10:24:34 | d    |   1500 |  -1500 |
|   1003 | 2021-01-12 09:23:09 | d    |   1000 |  -1000 |
|   1001 | 2021-02-28 11:43:13 | c    |    500 |    500 |
|   1002 | 2021-03-13 12:23:31 | d    |    500 |   -500 |
|   1002 | 2021-03-01 11:20:43 | c    |   1500 |   1500 |
|   1003 | 2021-02-24 11:34:32 | c    |    200 |    200 |
|   1002 | 2021-04-30 14:20:32 | d    |   6000 |  -6000 |
|   1001 | 2021-02-27 11:43:10 | d    |   2000 |  -2000 |
|   1001 | 2021-03-17 09:15:23 | c    |   1200 |   1200 |
|   1003 | 2021-04-06 09:13:22 | d    |   4500 |  -4500 |
|   1003 | 2021-02-04 11:32:43 | d    |   4200 |  -4200 |
|   1001 | 2021-05-14 10:17:10 | c    |    600 |    600 |
|   1003 | 2021-02-07 14:45:33 | c    |    400 |    400 |
|   1002 | 2021-04-29 15:53:23 | c    |   1200 |   1200 |
|   1002 | 2021-06-23 09:53:54 | c    |   1600 |   1600 |
|   1003 | 2021-03-06 11:50:34 | d    |   3000 |  -3000 |
|   1002 | 2021-04-30 14:20:33 | d    |   3000 |  -3000 |
|   1001 | 2021-05-14 10:17:13 | c    |    600 |    600 |
|   1003 | 2021-01-01 14:00:05 | d    |   7000 |  -7000 |
|   1002 | 2021-06-23 09:53:57 | c    |    250 |    250 |
|   1001 | 2021-05-14 10:17:18 | d    |   5600 |  -5600 |
|   1003 | 2021-03-06 11:50:37 | c    |    200 |    200 |
+--------+---------------------+------+--------+--------+
33 rows in set (0.00 sec)

mysql> select sal from emp1;
+----------+
| sal      |
+----------+
|  9000.00 |
|  8000.00 |
|  7000.00 |
|  7000.79 |
|  8000.48 |
|  3000.00 |
| 23700.00 |
|  4700.00 |
|  8000.00 |
|  7000.00 |
|  7000.15 |
| 18000.00 |
|  3000.00 |
| 13700.00 |
| 20000.00 |
| 14700.00 |
| -9500.00 |
|  1600.00 |
|  1100.00 |
|  4500.00 |
|  2950.00 |
|  2222.00 |
|  4975.30 |
|  5400.00 |
|  6000.99 |
|  3600.00 |
|  4250.98 |
|  1500.00 |
|  5250.00 |
|  1600.00 |
|  4500.00 |
|  2950.00 |
|  2222.00 |
|  4975.00 |
|  4250.00 |
|  3600.00 |
| -1600.00 |
| -3100.00 |
| -1100.00 |
| -1100.00 |
| -1600.00 |
|  1500.00 |
|  5400.00 |
|  5250.70 |
|   800.00 |
|  4100.00 |
|  1600.00 |
|  1250.00 |
|  2975.00 |
|  1250.00 |
|  2850.00 |
|  2450.00 |
|  3000.00 |
|  5000.00 |
|  1500.00 |
|  1100.00 |
|  1100.00 |
|   950.00 |
|  3000.00 |
|  1300.00 |
|  4900.00 |
|  6000.00 |
|  1100.00 |
|  4900.00 |
|  1600.00 |
|  1600.00 |
|  3100.00 |
|  1100.00 |
+----------+
68 rows in set (0.05 sec)

mysql> select sal,-sal from emp1;
+----------+-----------+
| sal      | -sal      |
+----------+-----------+
|  9000.00 |  -9000.00 |
|  8000.00 |  -8000.00 |
|  7000.00 |  -7000.00 |
|  7000.79 |  -7000.79 |
|  8000.48 |  -8000.48 |
|  3000.00 |  -3000.00 |
| 23700.00 | -23700.00 |
|  4700.00 |  -4700.00 |
|  8000.00 |  -8000.00 |
|  7000.00 |  -7000.00 |
|  7000.15 |  -7000.15 |
| 18000.00 | -18000.00 |
|  3000.00 |  -3000.00 |
| 13700.00 | -13700.00 |
| 20000.00 | -20000.00 |
| 14700.00 | -14700.00 |
| -9500.00 |   9500.00 |
|  1600.00 |  -1600.00 |
|  1100.00 |  -1100.00 |
|  4500.00 |  -4500.00 |
|  2950.00 |  -2950.00 |
|  2222.00 |  -2222.00 |
|  4975.30 |  -4975.30 |
|  5400.00 |  -5400.00 |
|  6000.99 |  -6000.99 |
|  3600.00 |  -3600.00 |
|  4250.98 |  -4250.98 |
|  1500.00 |  -1500.00 |
|  5250.00 |  -5250.00 |
|  1600.00 |  -1600.00 |
|  4500.00 |  -4500.00 |
|  2950.00 |  -2950.00 |
|  2222.00 |  -2222.00 |
|  4975.00 |  -4975.00 |
|  4250.00 |  -4250.00 |
|  3600.00 |  -3600.00 |
| -1600.00 |   1600.00 |
| -3100.00 |   3100.00 |
| -1100.00 |   1100.00 |
| -1100.00 |   1100.00 |
| -1600.00 |   1600.00 |
|  1500.00 |  -1500.00 |
|  5400.00 |  -5400.00 |
|  5250.70 |  -5250.70 |
|   800.00 |   -800.00 |
|  4100.00 |  -4100.00 |
|  1600.00 |  -1600.00 |
|  1250.00 |  -1250.00 |
|  2975.00 |  -2975.00 |
|  1250.00 |  -1250.00 |
|  2850.00 |  -2850.00 |
|  2450.00 |  -2450.00 |
|  3000.00 |  -3000.00 |
|  5000.00 |  -5000.00 |
|  1500.00 |  -1500.00 |
|  1100.00 |  -1100.00 |
|  1100.00 |  -1100.00 |
|   950.00 |   -950.00 |
|  3000.00 |  -3000.00 |
|  1300.00 |  -1300.00 |
|  4900.00 |  -4900.00 |
|  6000.00 |  -6000.00 |
|  1100.00 |  -1100.00 |
|  4900.00 |  -4900.00 |
|  1600.00 |  -1600.00 |
|  1600.00 |  -1600.00 |
|  3100.00 |  -3100.00 |
|  1100.00 |  -1100.00 |
+----------+-----------+
68 rows in set (0.00 sec)

mysql> select -5*-1;
+-------+
| -5*-1 |
+-------+
|     5 |
+-------+
1 row in set (0.00 sec)

mysql> table emp;
+-------+----------+--------+---------------------+------+------------+------+------+--------+---------+--------------+------------+------------+----------+
| EMPNO | ENAME    | GENDER | JOB                 | MGR  | HIREDATE   | SAL  | COMM | DEPTNO | BONUSID | USER NAME    | PWD        | PHONE      | isActive |
+-------+----------+--------+---------------------+------+------------+------+------+--------+---------+--------------+------------+------------+----------+
|  6001 | GITA     | F      | Compliance officers | 7920 | 1981-07-19 | 1750 | NULL |     30 |       1 | GITA         | sales@2017 | NULL       |        1 |
|  6129 | VRUSHALI | F      | Compliance officers | 7920 | 1981-07-19 | 1750 | NULL |     50 |       1 | VRUSHALI     | PUN@8877   | NULL       |        1 |
|  6473 | SHARMIN  | F      | Public Relation     | 7920 | 1981-07-19 | 1750 | NULL |     20 |       1 | SHARMIN      | a12recmpm  | NULL       |        1 |
|  6781 | BANDISH  | F      | Public Relation     | 7920 | 1981-07-19 | 1750 | NULL |     20 |       1 | BANDISH      | a12recmpm  | NULL       |        1 |
|  7369 | SMITH    | M      | CLERK               | 7902 | 1980-12-17 |  800 | NULL |     20 |       2 | TRITONE      | a12recmpm  | 7032300023 |        0 |
|  7415 | AARAV    | M      | CLERK               | 7902 | 1981-12-31 | 3350 | NULL |     10 |    NULL | AARAV        | NULL       | 7032300084 |        0 |
|  7421 | THOMAS   | M      | CLERK               | 7920 | 1981-07-19 | 1750 | NULL |     10 |       1 | THOMAS       | r50mpm     | 7032300011 |        0 |
|  7499 | ALLEN    | M      | SALESMAN            | 7698 | 1981-02-20 | 1600 |  300 |     30 |       4 | ALWAYS TESTE | sales@2017 | 7032300096 |        1 |
|  7521 | WARD     | M      | SALESMAN            | 7698 | 1981-02-22 | 1250 |  500 |     30 |       1 | WARD         | sales@2017 | 7132300034 |        1 |
|  7566 | JONES    | M      | MANAGER             | 7839 | 1981-04-02 | 2975 | NULL |     20 |       4 | HONEYCOMB    | a12recmpm  | 7132300039 |        1 |
|  7654 | MARTIN   | M      | SALESMAN            | 7698 | 1981-09-28 | 1250 | 1400 |     30 |       6 | LIFE RACER   | sales@2017 | 7132300050 |        1 |
|  7698 | BLAKE    | M      | MANAGER             | 7839 | 1981-05-01 | 2850 | NULL |     30 |       1 | BIG BEN      | sales@2017 | 7132300027 |        1 |
|  7782 | CLARK    | M      | MANAGER             | 7839 | 1981-06-09 | 2450 | NULL |     10 |       3 | CLARK        | r50mpm     | 7032300001 |        1 |
|  7788 | SCOTT    | M      | ANALYST             | 7566 | 1982-12-09 | 3000 | NULL |     20 |       3 | WHITE SAND   | a12recmpm  | NULL       |        1 |
|  7839 | KING     | M      | PRESIDENT           | NULL | 1981-11-17 | 5000 | NULL |     10 |       1 | KING         | r50mpm     | 7132300081 |        1 |
|  7840 | FRED     | M      | vice PRESIDENT      | 7839 | 1983-08-09 | 5000 | NULL |     20 |       1 | SAND STONE   | a12recmpm  | NULL       |        1 |
|  7844 | TURNER   | M      | SALESMAN            | 7698 | 1981-09-08 | 1500 |    0 |     30 |       5 | SAND DUST    | sales@2017 | NULL       |        1 |
|  7876 | ADAMS    | M      | CLERK               | 7788 | 1983-01-12 | 1100 | NULL |     20 |       1 | CRAZY ANYONE | a12recmpm  | 7132300086 |        1 |
|  7900 | JAMES    | M      | CLERK               | 7698 | 1981-12-03 |  950 | NULL |     30 |       2 | CRAZY LEADER | sales@2017 | 7132300042 |        1 |
|  7902 | FORD     | M      | ANALYST             | 7566 | 1981-12-03 | 3000 | NULL |     20 |       4 | CONBRIO      | a12recmpm  | NULL       |        0 |
|  7919 | HOFFMAN  | M      | MANAGER             | 7566 | 1982-03-24 | 4150 | NULL |     30 |       3 | INTERVAL     | sales@2017 | NULL       |        1 |
|  7920 | GRASS    | M      | SALESMAN            | 7919 | 1980-02-14 | 2575 | 2700 |     30 |       5 | GRASS        | sales@2017 | NULL       |        1 |
|  7934 | MILLER   | M      | CLERK               | 7782 | 1982-01-23 | 1300 | NULL |     10 |       2 | QUARTERNOTE  | r50mpm     | 7132300055 |        0 |
|  7945 | AARUSH   | M      | SALESMAN            | 7902 | 1980-02-14 | 1350 | 2700 |     30 |    NULL | AARUSH       | ABCDEF     | NULL       |        0 |
|  7949 | ALEX     | M      | MANAGER             | 7698 | 1982-01-24 | 1250 |  500 |     30 |       5 | QUARTERREST  | sales@2017 | 7156567183 |        1 |
|  8433 | NATASHA  | F      | CLERK               | 7920 | 1981-07-19 | 1750 | NULL |     30 |       1 | NATASHA      | sales@2017 | NULL       |        1 |
|  9400 | SANGITA  | F      | Compliance officers | 7920 | 1981-07-19 | 1750 | NULL |     50 |       1 | SANGITA      | NULL       | NULL       |        1 |
|  9473 | SUPRIYA  | F      | ANALYST             | 7920 | 1981-07-19 | 1750 | NULL |     50 |       1 | SUPRIYA      | XYZ@1234   | NULL       |        1 |
+-------+----------+--------+---------------------+------+------------+------+------+--------+---------+--------------+------------+------------+----------+
28 rows in set (0.00 sec)

mysql> select * from emp where left(ename,1) in ('a','e','i','o','u');
+-------+--------+--------+----------+------+------------+------+------+--------+---------+--------------+------------+------------+----------+
| EMPNO | ENAME  | GENDER | JOB      | MGR  | HIREDATE   | SAL  | COMM | DEPTNO | BONUSID | USER NAME    | PWD        | PHONE      | isActive |
+-------+--------+--------+----------+------+------------+------+------+--------+---------+--------------+------------+------------+----------+
|  7415 | AARAV  | M      | CLERK    | 7902 | 1981-12-31 | 3350 | NULL |     10 |    NULL | AARAV        | NULL       | 7032300084 |        0 |
|  7499 | ALLEN  | M      | SALESMAN | 7698 | 1981-02-20 | 1600 |  300 |     30 |       4 | ALWAYS TESTE | sales@2017 | 7032300096 |        1 |
|  7876 | ADAMS  | M      | CLERK    | 7788 | 1983-01-12 | 1100 | NULL |     20 |       1 | CRAZY ANYONE | a12recmpm  | 7132300086 |        1 |
|  7945 | AARUSH | M      | SALESMAN | 7902 | 1980-02-14 | 1350 | 2700 |     30 |    NULL | AARUSH       | ABCDEF     | NULL       |        0 |
|  7949 | ALEX   | M      | MANAGER  | 7698 | 1982-01-24 | 1250 |  500 |     30 |       5 | QUARTERREST  | sales@2017 | 7156567183 |        1 |
+-------+--------+--------+----------+------+------------+------+------+--------+---------+--------------+------------+------------+----------+
5 rows in set (0.00 sec)

mysql> select left(ename,1) from emp;
+---------------+
| left(ename,1) |
+---------------+
| G             |
| V             |
| S             |
| B             |
| S             |
| A             |
| T             |
| A             |
| W             |
| J             |
| M             |
| B             |
| C             |
| S             |
| K             |
| F             |
| T             |
| A             |
| J             |
| F             |
| H             |
| G             |
| M             |
| A             |
| A             |
| N             |
| S             |
| S             |
+---------------+
28 rows in set (0.00 sec)

mysql> select * from emp where ename like '%a%e%i%o%u%';
Empty set (0.00 sec)

mysql> select * from emp where ename like '%a%' or ename like '%i%;
    '> ;
    '> ^C
mysql> select * from emp where ename like '%a%' or ename like '%i%';
+-------+----------+--------+---------------------+------+------------+------+------+--------+---------+--------------+------------+------------+----------+
| EMPNO | ENAME    | GENDER | JOB                 | MGR  | HIREDATE   | SAL  | COMM | DEPTNO | BONUSID | USER NAME    | PWD        | PHONE      | isActive |
+-------+----------+--------+---------------------+------+------------+------+------+--------+---------+--------------+------------+------------+----------+
|  6001 | GITA     | F      | Compliance officers | 7920 | 1981-07-19 | 1750 | NULL |     30 |       1 | GITA         | sales@2017 | NULL       |        1 |
|  6129 | VRUSHALI | F      | Compliance officers | 7920 | 1981-07-19 | 1750 | NULL |     50 |       1 | VRUSHALI     | PUN@8877   | NULL       |        1 |
|  6473 | SHARMIN  | F      | Public Relation     | 7920 | 1981-07-19 | 1750 | NULL |     20 |       1 | SHARMIN      | a12recmpm  | NULL       |        1 |
|  6781 | BANDISH  | F      | Public Relation     | 7920 | 1981-07-19 | 1750 | NULL |     20 |       1 | BANDISH      | a12recmpm  | NULL       |        1 |
|  7369 | SMITH    | M      | CLERK               | 7902 | 1980-12-17 |  800 | NULL |     20 |       2 | TRITONE      | a12recmpm  | 7032300023 |        0 |
|  7415 | AARAV    | M      | CLERK               | 7902 | 1981-12-31 | 3350 | NULL |     10 |    NULL | AARAV        | NULL       | 7032300084 |        0 |
|  7421 | THOMAS   | M      | CLERK               | 7920 | 1981-07-19 | 1750 | NULL |     10 |       1 | THOMAS       | r50mpm     | 7032300011 |        0 |
|  7499 | ALLEN    | M      | SALESMAN            | 7698 | 1981-02-20 | 1600 |  300 |     30 |       4 | ALWAYS TESTE | sales@2017 | 7032300096 |        1 |
|  7521 | WARD     | M      | SALESMAN            | 7698 | 1981-02-22 | 1250 |  500 |     30 |       1 | WARD         | sales@2017 | 7132300034 |        1 |
|  7654 | MARTIN   | M      | SALESMAN            | 7698 | 1981-09-28 | 1250 | 1400 |     30 |       6 | LIFE RACER   | sales@2017 | 7132300050 |        1 |
|  7698 | BLAKE    | M      | MANAGER             | 7839 | 1981-05-01 | 2850 | NULL |     30 |       1 | BIG BEN      | sales@2017 | 7132300027 |        1 |
|  7782 | CLARK    | M      | MANAGER             | 7839 | 1981-06-09 | 2450 | NULL |     10 |       3 | CLARK        | r50mpm     | 7032300001 |        1 |
|  7839 | KING     | M      | PRESIDENT           | NULL | 1981-11-17 | 5000 | NULL |     10 |       1 | KING         | r50mpm     | 7132300081 |        1 |
|  7876 | ADAMS    | M      | CLERK               | 7788 | 1983-01-12 | 1100 | NULL |     20 |       1 | CRAZY ANYONE | a12recmpm  | 7132300086 |        1 |
|  7900 | JAMES    | M      | CLERK               | 7698 | 1981-12-03 |  950 | NULL |     30 |       2 | CRAZY LEADER | sales@2017 | 7132300042 |        1 |
|  7919 | HOFFMAN  | M      | MANAGER             | 7566 | 1982-03-24 | 4150 | NULL |     30 |       3 | INTERVAL     | sales@2017 | NULL       |        1 |
|  7920 | GRASS    | M      | SALESMAN            | 7919 | 1980-02-14 | 2575 | 2700 |     30 |       5 | GRASS        | sales@2017 | NULL       |        1 |
|  7934 | MILLER   | M      | CLERK               | 7782 | 1982-01-23 | 1300 | NULL |     10 |       2 | QUARTERNOTE  | r50mpm     | 7132300055 |        0 |
|  7945 | AARUSH   | M      | SALESMAN            | 7902 | 1980-02-14 | 1350 | 2700 |     30 |    NULL | AARUSH       | ABCDEF     | NULL       |        0 |
|  7949 | ALEX     | M      | MANAGER             | 7698 | 1982-01-24 | 1250 |  500 |     30 |       5 | QUARTERREST  | sales@2017 | 7156567183 |        1 |
|  8433 | NATASHA  | F      | CLERK               | 7920 | 1981-07-19 | 1750 | NULL |     30 |       1 | NATASHA      | sales@2017 | NULL       |        1 |
|  9400 | SANGITA  | F      | Compliance officers | 7920 | 1981-07-19 | 1750 | NULL |     50 |       1 | SANGITA      | NULL       | NULL       |        1 |
|  9473 | SUPRIYA  | F      | ANALYST             | 7920 | 1981-07-19 | 1750 | NULL |     50 |       1 | SUPRIYA      | XYZ@1234   | NULL       |        1 |
+-------+----------+--------+---------------------+------+------------+------+------+--------+---------+--------------+------------+------------+----------+
23 rows in set (0.00 sec)

mysql> select * from emp where ename in '%a%' or ename in '%i%';
ERROR 1064 (42000): You have an error in your SQL syntax; check the manual that corresponds to your MySQL server version for the right syntax to use near ''%a%' or ename in '%i%'' at line 1
mysql> select * from emp where ename like in ('%a%', '%i%');
ERROR 1064 (42000): You have an error in your SQL syntax; check the manual that corresponds to your MySQL server version for the right syntax to use near 'in ('%a%', '%i%')' at line 1
mysql> select * from emp where ename like in('%a%','%i%');
ERROR 1064 (42000): You have an error in your SQL syntax; check the manual that corresponds to your MySQL server version for the right syntax to use near 'in('%a%','%i%')' at line 1
mysql>

